,title,description,ingredients,preparation,tags,allergens,skill,time,author,link
13,Drożdżowe rogaliki dyniowe z kremem kakaowym,"Wyjątkowa wariacja na temat drożdżowych rogalików, na bazie ciasta dyniowego i nadzienia kakaowego. Oto przepis na obłędnie pyszne, pachnące i mięciutkie zawijańce,  których przygotowanie zajmuje niewiele czasu. Nadają się jako dodatek do śniadania, idealnie osłodzą także jesienne, południowe spotkania przy herbacie lub kawie. ","[['SKŁADNIKI NA CIASTO'], [450, 'Gramów', 'mąka pszenna tortowa Lubella'], [8, 'Gramów', 'drożdże'], [130, 'Gramów', 'dyniowe puree'], ['0.5 Łyżeczki sól'], [60, 'Gramów', 'cukier'], [100, 'Mililitrów', 'mleko UHT 3,2%'], [80, 'Gramów', 'masło'], [1, 'Sztuka', 'białko jaja kurzego'], ['SKŁADNIKI NA NADZIENIE'], [2, 'Łyżki', 'Kakao DecoMorreno'], [120, 'Gramów', 'orzechy włoskie'], [50, 'Gramów', 'masło']]","['W rondelku podgrzej mleko wraz masłem. W misce wymieszaj mleko, masło, puree dyniowe oraz jajka. Następnie dodaj mąkę, drożdże, cukier i sól.', 'Całość wyrabiaj tak długo aż ciasto stanie się gładkie i sprężyste. W następnym kroku przełóż ciasto do miski, przykryj ściereczką i odstaw na około 45 minut w ciepłe miejsce - aby podwoiło swoją objętość.', 'W międzyczasie przygotuj nadzienie. Zmiel orzechy, lub bardzo drobno posiekaj. Wymieszaj z rozpuszczonym masłem, miodem oraz kakao.', 'Gdy ciasto wyrośnie zagnieć je ponownie i podziel na 2 części. Rozwałkuj każdą z nich na cienkie placki, pokrój w trójkąty (12) i nakładaj porcje nadzienia.', 'Zawijaj rogaliki i kolejno odkładaj na blachę. Następnie przykryj je ściereczką i odstaw ponownie do wyrośnięcia (około 20 minut). Przed pieczeniem posmaruj je jeszcze roztrzepanym białkiem.', 'Rogaliki piecz, aż pięknie się zarumienią, przez około 15 -20 minut w temperaturze 180°C.']","['sól', 'na słodko', 'cukier', 'masło', 'wypieki', 'impreza', 'deser', 'kakao decomorreno', 'podwieczorek', 'kakao', 'mąka pszenna tortowa lubella', 'miód', 'bezmięsna', 'mleko uht 3,2%', 'drożdże', 'urodziny imieniny', 'orzechy włoskie', 'białko jaja kurzego', 'drugie śniadanie', 'dyniowe puree']",None,Średni,"Do 1,5 godz",decomorreno,http://uwielbiam.pl//przepis/drozdzowe-rogaliki-dyniowe-z-kremem-kakaowym
14,Delikatne ciasto czekoladowo dyniowe,"Prezentujemy przepis na ciasto bardzo dyniowe, idealny aromatyczny deser na jesienną słotę. Delikatny, puszysty, lekko wilgotny – znakomity placek dyniowy, w sam raz na jesienne popołudnia. Wyśmienicie smakuje w towarzystwie gorącej czekolady.","[['SKŁADNIKI NA CIASTO'], ['2.5 Szklanki mąka pszenna tortowa Lubella'], [200, 'Gramów', 'masło'], [500, 'Gramów', 'cukier puder'], [4, 'Sztuki', 'jajko'], [2, 'Łyżki', 'PROSZEK DO PIECZENIA'], [1, 'Szczypta', 'sól'], [125, 'Mililitrów', 'Maślanka'], ['SKŁADNIKI NA CIASTO DYNIOWE'], ['0.5 Szklanki mąka pszenna tortowa Lubella'], [130, 'Gramów', 'dyniowe puree'], ['SKŁADNIKI NA CIASTO CZEKOLADOWE'], ['0.5 Szklanki Kakao DecoMorreno'], [60, 'Mililitrów', 'Maślanka']]","['Rozgrzej piekarnik do 180°C. Przygotuj ciasto podstawowe: miękkie masło utrzyj z cukrem na puszysty krem, dodaj jajka i ponownie ubij.', 'Do tak przygotowanego ciasta wsyp mąkę, proszek do pieczenia oraz sól. Następnie dodaj maślankę i zmiksuj wszystko na gładkie ciasto.', 'Ciasto podziel na dwie części. Do jednej z nich dodaj puree oraz mąkę. Do drugiej dodaj kakao oraz maślankę.', 'Długą formę keksową wyłóż papierem do pieczenia. Nakładaj do niej na przemian: ciasto dyniowe oraz czekoladowe.', 'Na koniec całość wymieszaj delikatnie długą wykałaczką, tak aby oba odcienie ciasta lekko się ze sobą wymieszały. Piecz przez około 60 minut w temperaturze 180°C.']","['sól', 'na słodko', 'warzywa', 'masło', 'wypieki', 'proszek do pieczenia', 'impreza', 'deser', 'kakao decomorreno', 'cukier puder', 'jajko', 'podwieczorek', 'kakao', 'mąka pszenna tortowa lubella', 'fit', 'uroczystości', 'nowoczesne', 'maślanka', 'dyniowe puree']","['Gluten', 'Laktoza', 'Jajka']",Średni,"Do 1,5 godz",decomorreno,http://uwielbiam.pl//przepis/delikatne-ciasto-czekoladowo-dyniowe
15,4 - składnikowe fit ciasteczka śniadaniowe - bez cukru i glutenu,"Prezentujemy super- prosty, pożywny i szybki przepis dla wszystkich amatorów FIT słodkości. Nasze ciasteczka śniadaniowe są bezglutenowe i nie posiadają zbędnego dodatku cukru, a mimo to pozostają rozkosznie słodkie, miękkie i wyjątkowo smaczne. Możesz je ""włożyć do kieszeni"" i zabrać ze sobą na uczelnię/ do szkoły lub pracy. Wspaniale nadają się także do kawy lub jako zdrowa przekąska po treningu. ","[[50, 'Gramów', 'Kakao DecoMorreno'], [320, 'Gramów', 'Płatki owsiane'], [3, 'Sztuki', 'Dojrzałe banany']]","['Zblenduj płatki owsiane (bezglutenowe) na mąkę. Olej kokosowy rozpuść. W misce wymieszaj wszystkie składniki.', 'Ciasto przykryj folią i włóż do lodówki na około 25 minut.', 'Po tym czasie formuj z ciasta małe ciasteczka i piecz je przez oko 12-15 minut w temperaturze 180°C.']","['na słodko', 'deser', 'kakao decomorreno', 'podwieczorek', 'kakao', 'przystawki i przekąski', 'fit', 'płatki owsiane', 'bez glutenu', 'olej kokosowy', 'dojrzałe banany']",None,Łatwy,Do 40 min,decomorreno,http://uwielbiam.pl//przepis/4-skladnikowe-fit-ciasteczka-sniadaniowe-bez-cukru-i-glutenu
16,Najprostszy omlet bananowo- owsiany w 5 minut! ,"Specjalnie dla miłośników fit- śniadań na słodko przygotowaliśmy ten niezwykle pożywny, a przy tym bardzo łatwy w przygotowaniu przepis na omlet bananowo- owsiany. Nasza omletowa propozycja składa się z bardzo prostych a przy tym niezwykle zdrowych składników. Dodaje energii, pięknie wygląda i do tego pysznie smakuje, czego chcieć więcej?","[[15, 'Gramów', 'Kakao DecoMorreno'], [24, 'Gramy', 'mąka owsiana'], [1, 'Sztuka', 'Dojrzałe banany'], [2, 'Sztuki', 'jajko'], [1, 'Łyżka', 'Olej kokosowy'], [1, 'Garść', 'owoce']]","['Wszystkie składniki zblenduj. Na patelni podgrzej 1 łyżkę oleju kokosowego.', 'Wlej ciasto i smaż omleta na małej mocy kuchenki. Obróć na drugą stronę po około 2 minutach.', 'Gotowy omlet  podawaj z ulubionymi dodatkami, np. owocami, jogurtem.']","['na słodko', 'dla dzieci', 'deser', 'kakao decomorreno', 'śniadanie', 'jajko', 'podwieczorek', 'kakao', 'fit', 'grill i piknik', 'śniadanie', 'olej kokosowy', 'drugie śniadanie', 'owoce', 'mąka owsiana', 'dojrzałe banany']","['Gluten', 'Jajka']",Łatwy,Do 15 min,decomorreno,http://uwielbiam.pl//przepis/najprostszy-omlet-bananowo-owsiany-w-5-minut
17,Ciasteczka thumbprint z nadzieniem krówkowym i orzechami,"Przedstawiamy naszą krówkowo-orzechową ciasteczkową wariację. Są to pyszne, chrupiące i bardzo efektowne ciasteczka z wyraźną nutą kakaową. Idealnie sprawdzą się jako dodatek do kawy lub kubka herbaty podczas długich jesienno-zimowych wieczorów.","[['SKŁADNIKI NA CIASTO'], [130, 'Gramów', 'mąka pszenna tortowa Lubella'], [30, 'Gramów', 'Kakao DecoMorreno'], [110, 'Gramów', 'masło'], [150, 'Gramów', 'cukier'], [1, 'Szczypta', 'sól'], [2, 'Sztuki', 'jajko'], [1, 'Szklanka', 'Orzechy laskowe mielone'], ['SKŁADNIKI NA NADZIENIE'], [150, 'Gramów', 'Cukierki krówki'], [3, 'Łyżki', 'śmietanka kremowa 30%'], [50, 'Gramów', 'Mleczna czekolada']]","['Wymieszaj w misce mąkę i kakao. W drugiej misce zmiksuj masło z cukrem i solą na puszystą masę. Dodaj żółtka z jajek. W następnej kolejności dodaj suche składniki i miksuj całość aż do połączenia.', 'Przykryj ciasto folią i wstaw do lodówki na godzinę. Następnie roztrzep białko widelcem. Formuj małe kulki z ciasta, mocz je w białku i obtaczaj w orzechach.', 'Przygotowane w ten sposób ciastka układaj na blasze w odstępach. Na środku każdego ciasteczka zrób wgłębienie. Piecz je w  nagrzanym do 180°C piekarniku przez około 10-12 minut.', 'Upieczone ciastka ostudź, po czym ponownie zrób w nich wgłębienia. W małym rondlu rozpuść krówki ze śmietanką. Tak przygotowaną masą wypełnij wgłębienia w ciastkach.', 'Gdy masa krówkowa zastygnie, rozpuść w kąpieli wodnej czekoladę i polej nią ciastka.']","['sól', 'na słodko', 'cukier', 'masło', 'wypieki', 'impreza', 'deser', 'kakao decomorreno', 'jajko', 'podwieczorek', 'kakao', 'przystawki i przekąski', 'mąka pszenna tortowa lubella', 'bezmięsna', 'śmietanka kremowa 30%', 'urodziny imieniny', 'grill i piknik', 'mleczna czekolada', 'orzechy laskowe mielone', 'cukierki krówki']","['Gluten', 'Laktoza', 'Mleko', 'Jajka']",Średni,"Do 1,5 godz",decomorreno,http://uwielbiam.pl//przepis/ciasteczka-thumbprint-z-nadzieniem-krowkowym-i-orzechami
18,Dyniowo-czekoladowa granola,"Mamy przyjemność zaprezentować królową jesiennych wariacji - aromatyczną dynię w niecodziennym, super-zdrowym wydaniu.
Nasza granola jest aromatycznie kakaowa, a przy tym przyjemnie chrupiąca i totalnie uzależniająca. Jest niezwykle łatwa w przygotowaniu. Dyniowo-kakaową granolę można zajadać z mlekiem/ jogurtem oraz w towarzystwie ulubionych owoców. Świetnie nada się także jako dodatek do różnego rodzaju pachnących jesienią deserów.","[[4, 'Łyżki', 'Kakao DecoMorreno'], [4, 'Szklanki', 'Płatki owsiane'], [1, 'Szklanka', 'komosa ryżowa'], ['0.5 Szklanki Orzechy laskowe'], ['0.5 Szklanki orzechy włoskie'], [1, 'Szklanka', 'Pistacje obrane'], [3, 'Łyżki', 'Siemie lniane'], [250, 'Gramów', 'dyniowe puree'], ['0.5 Szklanki Olej kokosowy'], [1, 'Szklanka', 'Syrop klonowy'], [1, 'Łyżeczka', 'sól'], [2, 'Łyżeczki', 'cynamon']]","['Nastaw piekarnik na 200°C.  Wymieszaj suche składniki - płatki owsiane oraz komosę. Następnie w oddzielnym naczyniu zmieszaj mokre składniki i przyprawy (puree z dyni, rozpuszczony olej kokosowy, syrop klonowy/ miód, kakao, sól oraz cynamon).', 'Połącz wszystkie składniki, mieszając je dokładnie. Następnie rozłóż muesli na 2 dużych blachach, wyłożonych papierem do pieczenia.', 'Przgotowaną mieszankę piecz przez 15 minut. Po tym czasie dodaj orzechy laskowe, włoskie oraz pistacje. Wymieszaj całość i zamień miejscami blachy. Piecz granolę przez kolejne 15-20 minut.', 'Wyjmij blachy z piekarnika i pozwól aby muesli całkowicie ostygło. Gotową granolę przechowuj w szczelnie zamkniętym pojemniku. Podawaj ją z mlekiem roślinnym lub jogurtem - z dodatkiem ulubionych owoców.']","['sól', 'na słodko', 'impreza', 'deser', 'kakao decomorreno', 'śniadanie', 'podwieczorek', 'kakao', 'przystawki i przekąski', 'fit', 'cynamon', 'orzechy włoskie', 'śniadanie', 'przepisy z płatkami', 'płatki owsiane', 'olej kokosowy', 'orzechy laskowe', 'drugie śniadanie', 'siemie lniane', 'syrop klonowy', 'dyniowe puree', 'pistacje obrane', 'komosa ryżowa']","['Gluten', 'Orzechy', 'ziemne']",Łatwy,Do 1 godz,decomorreno,http://uwielbiam.pl//przepis/dyniowo-czekoladowa-granola
19,Grecka zapiekanka pastitsio,.,"[[250, 'Gramów', 'Makaron Lubella Mini rurki z warzywami'], [600, 'Gramów', 'antrykot wołowy'], [1, 'Puszka', 'pomidory krojone bez skórki Łowicz'], [1, 'Sztuka', 'cebula'], [50, 'Mililitrów', 'Czerwone wino'], [1, 'Szczypta', 'sól, pieprz'], [1, 'Szczypta', 'gałka muszkatołowa'], [1, 'Szczypta', 'Cukier trzcinowy'], [1, 'Szczypta', 'Suszone oregano'], ['Sos beszamel:'], [2, 'Łyżki', 'mąka Lubella Puszysta tortowa'], [2, 'Szklanki', 'mleko'], [2, 'Łyżki', 'masło'], [1, 'Szczypta', 'sól'], [1, 'Szczypta', 'pieprz biały'], [1, 'Szczypta', 'gałka muszkatołowa'], ['Dodatkowo:'], ['0.25 Szklanki bułka tarta']]","['Makaron ugotować według wskazówek na opakowaniu, odcedzić- zostawiając 1/3 szklanki wody, ostudzić i wymieszać z 2/3 porcji sosu beszamel', '1/3 części makaronu przełożyć do dużego naczynia żaroodpornego, kolejno ułożyć połowę porcji mięsnej, ponownie makaron, mięso, makaron i pozostały sos beszamel.', 'Ser drobno zetrzeć, wymieszać z bułką tartą i posypać wierzch zapiekanki,\nPiec około 35 minut w 80 stopniach.', 'sos beszamel:\nNa patelni roztopić masło, dodać mąkę i wymieszać rózgą.\nWlać mleko i mieszać do momentu, aż sos zrobi się jednolity i gęsty.\nDoprawić solą, pieprzem i gałką muszkatołową do smaku.']","['dla rodziny', 'dania główne', 'sól', 'cebula', 'sól, pieprz', 'masło', 'mleko', 'kolacja', 'bułka tarta', 'śródziemnomorska', 'bez mięsa', 'mąka lubella puszysta tortowa', 'dieta wegetariańska', 'gałka muszkatołowa', 'cukier trzcinowy', 'pieprz biały', 'suszone oregano', 'makaron lubella mini rurki z warzywami', 'pomidory krojone bez skórki łowicz', 'na słono', 'czerwone wino', 'antrykot wołowy', 'ser owczy']",None,Łatwy,"Do 1,5 godz",lubella,http://uwielbiam.pl//przepis/grecka-zapiekanka-pastitsio
